place,link,rating,city,category,fee,alamat,deskripsi
Keraton Ngayogyakarta Hadiningrat,https://www.google.com/maps/place/Keraton+Ngayogyakarta+Hadiningrat/data=!4m7!3m6!1s0x2e7a5796db06c7ef:0x395271cf052b276c!8m2!3d-7.8052845!4d110.3642031!16s%2Fm%2F0vb3k_5!19sChIJ78cG25ZXei4RbCcrBc9xUjk?authuser=0&hl=id&rclk=1,"4,60",Yogyakarta,Sejarah,25000,"Jl. Rotowijayan Blok No. 1, Panembahan, Kecamatan Kraton, Kota Yogyakarta, Daerah Istimewa Yogyakarta, Indonesia",Keraton Ngayogyakarta Hadiningrat
Sindu Kusuma Edupark (SKE),https://www.google.com/maps/place/Sindu+Kusuma+Edupark+%28SKE%29/data=!4m7!3m6!1s0x2e7a584281200f8b:0xeed0884f4b2272a8!8m2!3d-7.7678784!4d110.3545667!16s%2Fg%2F11b6vc54pq!19sChIJiw8ggUJYei4RqHIiS0-I0O4?authuser=0&hl=id&rclk=1,"4,20",Yogyakarta,"Edukasi, Anak",40000,,
Situs Warungboto,https://www.google.com/maps/place/Situs+Warungboto/data=!4m7!3m6!1s0x2e7a576dd45f6243:0x47c4825dd428cf01!8m2!3d-7.8101941!4d110.3932803!16s%2Fg%2F11h5rqc5md!19sChIJQ2Jf1G1Xei4RAc8o1F2CxEc?authuser=0&hl=id&rclk=1,"4,40",Yogyakarta,Sejarah,5000,"Jl. Veteran No.77, Warungboto, Kec. Umbulharjo, Kota Yogyakarta, Daerah Istimewa Yogyakarta 55164, Indonesia",Situs Warungboto
Kampung Wisata Taman Sari,https://www.google.com/maps/place/Kampung+Wisata+Taman+Sari/data=!4m7!3m6!1s0x2e7a5793d0c2cf2b:0x276a21f8a01cbe13!8m2!3d-7.8099788!4d110.3589907!16s%2Fm%2F0b6gg2m!19sChIJK8_C0JNXei4RE74coPghaic?authuser=0&hl=id&rclk=1,"4,60",Yogyakarta,Sejarah,25000,"Patehan, Kraton, Yogyakarta City, Special Region of Yogyakarta 55133, Indonesia",Taman Sari
Taman Pintar Yogyakarta,https://www.google.com/maps/place/Taman+Pintar+Yogyakarta/data=!4m7!3m6!1s0x2e7a57860f2fb9af:0xa9f6007074b62dd8!8m2!3d-7.8006715!4d110.3676551!16s%2Fm%2F0y6kq2z!19sChIJr7kvD4ZXei4R2C22dHAA9qk?authuser=0&hl=id&rclk=1,"4,50",Yogyakarta,"Edukasi, Anak",24000,"Jl. Panembahan Senopati No.1-3, Ngupasan, Kec. Gondomanan, Kota Yogyakarta, Daerah Istimewa Yogyakarta 55122, Indonesia",Taman Pintar Yogyakarta
Kawasan Wisata Malioboro,https://www.google.com/maps/place/Kawasan+Wisata+Malioboro/data=!4m7!3m6!1s0x2e7a578819c338f1:0x72aa3ad97ecccfb6!8m2!3d-7.7982487!4d110.3652793!16s%2Fg%2F11dd_kfc0g!19sChIJ8TjDGYhXei4Rts_Mftk6qnI?authuser=0&hl=id&rclk=1,"4,70",Yogyakarta,Kuliner,0,"Jl. Margo Mulyo Jl. Jend. Ahmad Yani No.106, Ngupasan, Kec. Gondomanan, Kota Yogyakarta, Daerah Istimewa Yogyakarta 55122, Indonesia","Malioboro adalah destinasi wisata ikonik di Yogyakarta yang menawarkan perpaduan budaya, sejarah, dan hiburan. Jalan ini dikenal sebagai surga belanja oleh-oleh khas seperti batik, kerajinan tangan, dan kuliner tradisional seperti gudeg dan bakpia. Suasananya kental dengan nuansa Jawa, lengkap dengan pengamen tradisional, pertunjukan seni jalanan, dan penjual lesehan yang menyajikan pengalaman makan khas Yogyakarta. Malioboro juga dekat dengan landmark bersejarah seperti Keraton Yogyakarta, Benteng Vredeburg, dan Tugu Yogyakarta. Wisatawan dapat menikmati keunikan transportasi tradisional seperti andong atau becak untuk menjelajahi area ini. Dengan suasana yang semakin hidup di malam hari, Malioboro menjadi tempat yang wajib dikunjungi untuk menikmati kehangatan budaya dan pesona Kota Yogyakarta."
Hutan Pinus Pengger,https://www.google.com/maps/place/Hutan+Pinus+Pengger/data=!4m7!3m6!1s0x2e7a53d8d54f0903:0xf33314fb0104fc60!8m2!3d-7.8712041!4d110.4595144!16s%2Fg%2F11f3cxtg5q!19sChIJAwlP1dhTei4RYPwEAfsUM_M?authuser=0&hl=id&rclk=1,"4,50",Yogyakarta,Alam,5000,"Jl. Dlingo-Patuk, Sendangsari, Terong, Kec. Dlingo, Kabupaten Bantul, Daerah Istimewa Yogyakarta 55783, Indonesia",Hutan Pinus Pengger
Taman Pelangi Jogja,https://www.google.com/maps/place/Taman+Pelangi+Jogja/data=!4m7!3m6!1s0x2e7a58f975c66097:0x99331d342ee5862d!8m2!3d-7.7503027!4d110.3694988!16s%2Fg%2F11x7vl1rr!19sChIJl2DGdflYei4RLYblLjQdM5k?authuser=0&hl=id&rclk=1,"4,20",Yogyakarta,Alam,28000,"Jl. Ring Road Utara, Jongkang, Sariharjo, Kec. Ngaglik, Kabupaten Sleman, Daerah Istimewa Yogyakarta 55284, Indonesia",Taman Pelangi Jogja
Wisata Kali Gajah Wong Mrican Giwangan,https://www.google.com/maps/place/Wisata+Kali+Gajah+Wong+Mrican+Giwangan/data=!4m7!3m6!1s0x2e7a571c6efb47ad:0x9f88b30f2819abae!8m2!3d-7.8311337!4d110.3941846!16s%2Fg%2F11c5bhfs47!19sChIJrUf7bhxXei4RrqsZKA-ziJ8?authuser=0&hl=id&rclk=1,"4,60",Yogyakarta,Alam,0,"599V+GMV, Mrican, Giwangan, Umbulharjo, Yogyakarta City, Special Region of Yogyakarta 55163, Indonesia",Wisata Kali Gajah Wong Mrican Giwangan
Museum Sonobudoyo Unit I,https://www.google.com/maps/place/Museum+Sonobudoyo+Unit+I/data=!4m7!3m6!1s0x2e7a578f83070a4f:0x9d10431ac43ec5ee!8m2!3d-7.8023333!4d110.3639441!16s%2Fg%2F11h1v81d_!19sChIJTwoHg49Xei4R7sU-xBpDEJ0?authuser=0&hl=id&rclk=1,"4,80",Yogyakarta,"Edukasi, Anak",20000,"Jl. Pangurakan No.6, Ngupasan, Kec. Gondomanan, Kota Yogyakarta, Daerah Istimewa Yogyakarta 55122, Indonesia",Museum Sonobudoyo Unit I
Puncak Pinus Becici,https://www.google.com/maps/place/Puncak+Pinus+Becici/data=!4m7!3m6!1s0x2e7a531aaaaaaaab:0x6c28149b91ea59f4!8m2!3d-7.9020355!4d110.4374627!16s%2Fg%2F11h2g21vfv!19sChIJq6qqqhpTei4R9FnqkZsUKGw?authuser=0&hl=id&rclk=1,"4,50",Yogyakarta,Alam,3000,"Gunungcilik, RT.07/RW.02, Gn. Cilik, Muntuk, Kec. Dlingo, Kabupaten Bantul, Daerah Istimewa Yogyakarta 55783, Indonesia",Becici Peak
Bukit Bintang,https://www.google.com/maps/place/Bukit+Bintang/data=!4m7!3m6!1s0x2e7a51a418acd7d3:0xfb055b6604992f0a!8m2!3d-7.8458407!4d110.4798457!16s%2Fg%2F1pv61n1m9!19sChIJ09esGKRRei4RCi-ZBGZbBfs?authuser=0&hl=id&rclk=1,"4,50",Yogyakarta,Alam,0,"Bukit Bintang, Kuala Lumpur, Federal Territory of Kuala Lumpur, Malaysia",Bukit Bintang
Plengkung Gading,https://www.google.com/maps/place/Plengkung+Gading/data=!4m7!3m6!1s0x2e7a5796f097cf41:0x89fc8d46097f458b!8m2!3d-7.8137278!4d110.3629074!16s%2Fg%2F11btlnnlpx!19sChIJQc-X8JZXei4Ri0V_CUaN_Ik?authuser=0&hl=id&rclk=1,"4,60",Yogyakarta,Sejarah,0,"Jl. Patehan Kidul No.4, Patehan, Kecamatan Kraton, Kota Yogyakarta, Daerah Istimewa Yogyakarta 55133, Indonesia",Plengkung Gading
Tebing Breksi,https://www.google.com/maps/place/Tebing+Breksi/data=!4m7!3m6!1s0x2e7a5aa458b4665b:0xa4b0fc6ad0ae38c7!8m2!3d-7.7815714!4d110.5045827!16s%2Fg%2F11fzry0lfb!19sChIJW2a0WKRaei4Rxziu0Gr8sKQ?authuser=0&hl=id&rclk=1,"4,50",Yogyakarta,Alam,20000,"Jl. Desa Lengkong, RT.02/RW.17, Gn. Sari, Sambirejo, Kec. Prambanan, Kabupaten Sleman, Daerah Istimewa Yogyakarta 55572, Indonesia",Tebing Breksi
Embung Langensari,https://www.google.com/maps/place/Embung+Langensari/data=!4m7!3m6!1s0x2e7a59d258bc6935:0xd72d8d2e7140104a!8m2!3d-7.7866148!4d110.3819311!16s%2Fg%2F11bwkhd4d1!19sChIJNWm8WNJZei4RShBAcS6NLdc?authuser=0&hl=id&rclk=1,"4,30",Yogyakarta,Alam,0,"Jl. Kusbini No.35, Klitren, Kec. Gondokusuman, Kota Yogyakarta, Daerah Istimewa Yogyakarta 55222, Indonesia",Embung Langensari
Candi Abang,https://www.google.com/maps/place/Candi+Abang/data=!4m7!3m6!1s0x2e7a508b5e9cb8e5:0xe4ec094fa5ffe7d9!8m2!3d-7.8103728!4d110.468686!16s%2Fg%2F1226mczs!19sChIJ5bicXotQei4R2ef_pU8J7OQ?authuser=0&hl=id&rclk=1,"4,30",Yogyakarta,Sejarah,2000,"5FQ9+VF3, Blambangan, Jogotirto, Kec. Berbah, Kabupaten Sleman, Daerah Istimewa Yogyakarta 55573, Indonesia",Candi Abang
Ekowisata Sungai Mudal,https://www.google.com/maps/place/Ekowisata+Sungai+Mudal/data=!4m7!3m6!1s0x2e7aee4a6fe974b7:0xc8f1e183fc8e2531!8m2!3d-7.7628136!4d110.1161626!16s%2Fg%2F11b7wn6mry!19sChIJt3Tpb0ruei4RMSWO_IPh8cg?authuser=0&hl=id&rclk=1,"4,70",Yogyakarta,Alam,2000,"Banyunganti, Jatimulyo, Girimulyo, Kulon Progo Regency, Special Region of Yogyakarta 55674, Indonesia",Taman Sungai Mudal
Candi Ijo,https://www.google.com/maps/place/Candi+Ijo/data=!4m7!3m6!1s0x2e7a5b1232407aa5:0x645c50631c5aaaeb!8m2!3d-7.783827!4d110.5118835!16s%2Fm%2F0s8ww5l!19sChIJpXpAMhJbei4R66paHGNQXGQ?authuser=0&hl=id&rclk=1,"4,80",Yogyakarta,Sejarah,7000,"Jl. Candi Ijo, Nglengkong, Sambirejo, Kec. Prambanan, Kabupaten Sleman, Daerah Istimewa Yogyakarta 55572, Indonesia",Ijo Temple
Candi Prambanan,https://www.google.com/maps/place/Candi+Prambanan/data=!4m7!3m6!1s0x2e7a5ae3dbd859d1:0x19e7a03b25955a2d!8m2!3d-7.7520206!4d110.4914674!16zL20vMDJzMF80!19sChIJ0VnY2-Naei4RLVqVJTug5xk?authuser=0&hl=id&rclk=1,"4,70",Yogyakarta,Sejarah,25000,"Jl. Raya Solo - Yogyakarta No.16, Kranggan, Bokoharjo, Kec. Prambanan, Kabupaten Sleman, Daerah Istimewa Yogyakarta 55571, Indonesia",Prambanan Temple
Blue Lagoon Jogja,https://www.google.com/maps/place/Blue+Lagoon+Jogja/data=!4m7!3m6!1s0x2e7a5c75eba9da15:0xd4d6063b3b163462!8m2!3d-7.7028328!4d110.4491103!16s%2Fg%2F11b6vhjqrb!19sChIJFdqp63Vcei4RYjQWOzsG1tQ?authuser=0&hl=id&rclk=1,"4,30",Yogyakarta,Pantai,15000,"Area Sawah, Widodomartani, Ngemplak, Sleman Regency, Special Region of Yogyakarta 55584, Indonesia",Blue Lagoon Jogja
Gembira Loka Zoo,https://www.google.com/maps/place/Gembira+Loka+Zoo/data=!4m7!3m6!1s0x2e7a57196b21a901:0x77e3f6112577fb0f!8m2!3d-7.8041337!4d110.3979883!16s%2Fm%2F0130d2nz!19sChIJAakhaxlXei4RD_t3JRH243c?authuser=0&hl=id&rclk=1,"4,50",Yogyakarta,"Safari, Alam",60000,"Jl. Kebun Raya No.2, Rejowinangun, Kec. Kotagede, Kota Yogyakarta, Daerah Istimewa Yogyakarta 55171, Indonesia",Gembira Loka Zoo
KEBON BINATANG,https://www.google.com/maps/place/KEBON+BINATANG/data=!4m7!3m6!1s0x2e7a57001e4d0cdb:0x90c47bdaf9aefbc7!8m2!3d-7.8039932!4d110.3981235!16s%2Fm%2F0k707j_!19sChIJ2wxNHgBXei4Rx_uu-dp7xJA?authuser=0&hl=id&rclk=1,"4,50",Yogyakarta,"Safari, Alam",60000,"2920 Zoo Dr, San Diego, CA 92101, United States",San Diego Zoo
Candi Sambisari,https://www.google.com/maps/place/Candi+Sambisari/data=!4m7!3m6!1s0x2e7a5a39b544a4ab:0xd8f5c2d79ac124f3!8m2!3d-7.7624548!4d110.4470446!16s%2Fm%2F064kb4b!19sChIJq6REtTlaei4R8yTBmtfC9dg?authuser=0&hl=id&rclk=1,"4,60",Yogyakarta,Sejarah,5000,"Jl. Candi Sambisari, Sambisari, Purwomartani, Kec. Kalasan, Kabupaten Sleman, Daerah Istimewa Yogyakarta 55571, Indonesia",Sambisari Temple
Jurang Tembelan Kanigoro,https://www.google.com/maps/place/Jurang+Tembelan+Kanigoro/data=!4m7!3m6!1s0x2e7a535efa9f6961:0xd94caa6b36062e9f!8m2!3d-7.9400233!4d110.4298257!16s%2Fg%2F11ddwymrn8!19sChIJYWmf-l5Tei4Rny4GNmuqTNk?authuser=0&hl=id&rclk=1,"4,50",Yogyakarta,Alam,5000,"Mangunan, Dlingo, Bantul Regency, Special Region of Yogyakarta 55783, Indonesia",Jurang Tembelan Kanigoro
Gumuk Pasir Parangkusumo,https://www.google.com/maps/place/Gumuk+Pasir+Parangkusumo/data=!4m7!3m6!1s0x2e7b009013455d2f:0x22e1771beec2dd40!8m2!3d-8.01845!4d110.3195509!16s%2Fg%2F11clt8fcsz!19sChIJL11FE5AAey4RQN3C7ht34SI?authuser=0&hl=id&rclk=1,"4,50",Yogyakarta,Alam,5000,"Jl. Pantai Parangkusumo RT. 1 Grogol 10, Jl. Pantai Parangkusumo No.16, Pantai, Parangtritis, Kec. Kretek, Kabupaten Bantul, Daerah Istimewa Yogyakarta 55772, Indonesia",Gumuk Pasir Parangkusumo
Hutan Pinus Mangunan,https://www.google.com/maps/place/Hutan+Pinus+Mangunan/data=!4m7!3m6!1s0x2e7a536355abb129:0x9fb567811ef62e4e!8m2!3d-7.9261073!4d110.4304652!16s%2Fg%2F11g9w4r_1f!19sChIJKbGrVWNTei4RTi72HoFntZ8?authuser=0&hl=id&rclk=1,"4,60",Yogyakarta,Alam,8000,"Jl raya Jl. Hutan Pinus Nganjir, Mangunan, Kec. Dlingo, Kabupaten Bantul, Daerah Istimewa Yogyakarta 55783, Indonesia",Mangunan Pines Forests
Galaxy Waterpark,https://www.google.com/maps/place/Galaxy+Waterpark/data=!4m7!3m6!1s0x2e7a57381999ae6f:0x6f677fc8515f1aaa!8m2!3d-7.8159633!4d110.4136917!16s%2Fg%2F11b6yrhw_w!19sChIJb66ZGThXei4RqhpfUch_Z28?authuser=0&hl=id&rclk=1,"4,40",Yogyakarta,"Air, Wahana, Anak",50000,"Wonosari St No.6, Kalangan, Baturetno, Banguntapan, Bantul Regency, Special Region of Yogyakarta 55196, Indonesia",Galaxy Waterpark
Keraton Ratu Boko,https://www.google.com/maps/place/Keraton+Ratu+Boko/data=!4m7!3m6!1s0x2e7a5a92d354fe45:0x153f44f14476f95b!8m2!3d-7.7705416!4d110.4894158!16s%2Fm%2F0264bpk!19sChIJRf5U05Jaei4RW_l2RPFEPxU?authuser=0&hl=id&rclk=1,"4,70",Yogyakarta,Sejarah,40000,"Jl. Raya Piyungan - Prambanan No.2, Gatak, Bokoharjo, Kec. Prambanan, Kabupaten Sleman, Daerah Istimewa Yogyakarta 5572, Indonesia",Ratu Boko Temple
Bukit Panguk Kediwung,https://www.google.com/maps/place/Bukit+Panguk+Kediwung/data=!4m7!3m6!1s0x2e7bacb24995d023:0x95aec26c5e9774a2!8m2!3d-7.9583695!4d110.4407622!16s%2Fg%2F11c44q7bf_!19sChIJI9CVSbKsey4RonSXXmzCrpU?authuser=0&hl=id&rclk=1,"4,50",Yogyakarta,Alam,35000,"Kediwung, Mangunan, Dlingo, Bantul Regency, Special Region of Yogyakarta 55783, Indonesia",Bukit Panguk Kediwung
Agrowisata Bhumi Merapi,https://www.google.com/maps/place/Agrowisata+Bhumi+Merapi/data=!4m7!3m6!1s0x2e7a60acafd671df:0xd2d3e41c9f632fd9!8m2!3d-7.6400756!4d110.4264098!16s%2Fg%2F11csbr8533!19sChIJ33HWr6xgei4R2S9jnxzk09I?authuser=0&hl=id&rclk=1,"4,50",Yogyakarta,Alam,30000,"Jl. Kaliurang No.Km.20, Sawungan, Hargobinangun, Kec. Pakem, Kabupaten Sleman, Daerah Istimewa Yogyakarta 55582, Indonesia",Agro Tourism Bhumi Merapi
Watu Goyang,https://www.google.com/maps/place/Watu+Goyang/data=!4m7!3m6!1s0x2e7a548fd0091f07:0xf2e5878e2fc74574!8m2!3d-7.9274086!4d110.4120586!16s%2Fg%2F11c31tj_lg!19sChIJBx8J0I9Uei4RdEXHL46H5fI?authuser=0&hl=id&rclk=1,"4,40",Yogyakarta,Alam,5000,"Cempluk, Jl. Watu Goyang No.1, Griloyo, Mangunan, Kec. Imogiri, Kabupaten Bantul, Daerah Istimewa Yogyakarta 55783, Indonesia",Watu Goyang
The World Landmarks - Merapi Park Yogyakarta,https://www.google.com/maps/place/The+World+Landmarks+-+Merapi+Park+Yogyakarta/data=!4m7!3m6!1s0x2e7a60adba455a61:0xf555018e07c5177a!8m2!3d-7.6209046!4d110.4216275!16s%2Fg%2F11gy3k_xsg!19sChIJYVpFuq1gei4RehfFB44BVfU?authuser=0&hl=id&rclk=1,"4,30",Yogyakarta,"Edukasi, Anak",35000,"Jl. Kaliurang No.KM. 22.5, Banteng, Hargobinangun, Kec. Pakem, Kabupaten Sleman, Daerah Istimewa Yogyakarta 55582, Indonesia",Merapi Park Yogyakarta
Obelix Hills,https://www.google.com/maps/place/Obelix+Hills/data=!4m7!3m6!1s0x2e7a51ebf3f2fe45:0xb25efea185fd6810!8m2!3d-7.8070987!4d110.5216184!16s%2Fg%2F11lh5mv72z!19sChIJRf7y8-tRei4REGj9haH-XrI?authuser=0&hl=id&rclk=1,"4,60",Yogyakarta,"Ekstrem, Wahana",20000,"Klumprit, Blok I & 2, Klumprit II, Wukirharjo, Kec. Prambanan, Kabupaten Sleman, Daerah Istimewa Yogyakarta 55572, Indonesia",Obelix Hills
De Mata Museum Jogja,https://www.google.com/maps/place/De+Mata+Museum+Jogja/data=!4m7!3m6!1s0x2e7a570cd99720e1:0x93c125605f67d153!8m2!3d-7.8163156!4d110.3871442!16s%2Fg%2F11b6gjh4bl!19sChIJ4SCX2QxXei4RU9FnX2AlwZM?authuser=0&hl=id&rclk=1,"4,40",Yogyakarta,"Edukasi, Anak",140000,"XT Square, Jl. Veteran No.150-151, Pandeyan, Kec. Umbulharjo, Kota Yogyakarta, Daerah Istimewa Yogyakarta 55161, Indonesia",De Mata Trick Eye Museum
Alam Kalibiru,https://www.google.com/maps/place/Wisata+Alam+Kalibiru/data=!4m7!3m6!1s0x2e7aeff7861e0b91:0x5604e4ced3f4227e!8m2!3d-7.8074219!4d110.1292682!16s%2Fg%2F11b7jz25fr!19sChIJkQsehvfvei4RfiL0087kBFY?authuser=0&hl=id&rclk=1,"4,40",Yogyakarta,Alam,20000,"Jalan Waduk Sermo, Kalibiru, Hargowilis, Kec. Kokap, Kabupaten Kulon Progo, Daerah Istimewa Yogyakarta 55653, Indonesia",Wisata Kalibiru
Kampung Wisata Sosromenduran,https://www.google.com/maps/place/Kampung+Wisata+Sosromenduran/data=!4m7!3m6!1s0x2e7a5826be29978d:0xe41a56956d58b8c7!8m2!3d-7.79219!4d110.362151!16s%2Fg%2F1pzs29j25!19sChIJjZcpviZYei4Rx7hYbZVWGuQ?authuser=0&hl=id&rclk=1,"4,10",Yogyakarta,Alam,0,"001, Jl. Sosrowijayan No.69, Sosromenduran, Gedong Tengen, Kota Yogyakarta, Daerah Istimewa Yogyakarta 55271, Indonesia",Kampung Wisata Sosromenduran
Borobudur Temple,"https://www.google.com/maps/place/Candi+Borobudur/@-7.6078738,110.1992452,707m/data=!3m1!1e3!4m10!1m2!2m1!1scandi+borobudur!3m6!1s0x2e7a8cf009a7d697:0xdd34334744dc3cb!8m2!3d-7.6078738!4d110.2037513!15sCg9jYW5kaSBib3JvYnVkdXJaESIPY2FuZGkgYm9yb2J1ZHVykgEPYnVkZGhpc3RfdGVtcGxl4AEA!16zL20vMDFoemNq?authuser=0&hl=id&entry=ttu&g_ep=EgoyMDI0MTExOC4wIKXMDSoJLDEwMjExMjMzSAFQAw%3D%3D","4,90",Yogyakarta,Sejarah,48000,"Jl. Badrawati, Kw. Candi Borobudur, Borobudur, Kec. Borobudur, Kabupaten Magelang, Jawa Tengah, Indonesia",Borobudur Temple
Candi Prambanan,"https://www.google.com/maps/place/Candi+Prambanan/@-7.7520206,110.4888925,707m/data=!3m2!1e3!4b1!4m6!3m5!1s0x2e7a5ae3dbd859d1:0x19e7a03b25955a2d!8m2!3d-7.7520206!4d110.4914674!16zL20vMDJzMF80?authuser=0&hl=id&entry=ttu&g_ep=EgoyMDI0MTExOC4wIKXMDSoJLDEwMjExMjMzSAFQAw%3D%3D","4,80",Yogyakarta,Sejarah,50000,"Jl. Raya Solo - Yogyakarta No.16, Kranggan, Bokoharjo, Kec. Prambanan, Kabupaten Sleman, Daerah Istimewa Yogyakarta 55571, Indonesia",Prambanan Temple
Kawasan Wisata Kota Tua Jakarta,https://www.google.com/maps/place/Kawasan+Wisata+Kota+Tua+Jakarta/data=!4m7!3m6!1s0x2e69ec2a940017ed:0xdfce12d4a0938133!8m2!3d-6.1350687!4d106.8136795!16s%2Fg%2F11d_v9mf_f!19sChIJ7RcAlCrsaS4RM4GToNQSzt8?authuser=0&hl=id&rclk=1,"4,6",Jakarta,Sejarah,0,"Kawasan Kota Tua, Taman Fatahillah No.1 7, RT.7/RW.7, Pinangsia, Kec. Taman Sari, Kota Jakarta Barat, Daerah Khusus Ibukota Jakarta 11110, Indonesia",Area kota tua dengan arsitektur kolonial
Jakarta AQuarium Safari,https://www.google.com/maps/place/Jakarta+AQuarium+Safari/data=!4m7!3m6!1s0x2e69f7fb7dfbb9a3:0xde7bf875b06023b1!8m2!3d-6.1749533!4d106.7900155!16s%2Fg%2F11qq01l_3l!19sChIJo7n7ffv3aS4RsSNgsHX4e94?authuser=0&hl=id&rclk=1,"4,7",Jakarta,"Safari, Alam",156800,"Letjen S. Parman St No.106, RT.3/RW.3, South Tanjung Duren, Grogol petamburan, West Jakarta City, Jakarta 11470, Indonesia",·
Taman Suropati,https://www.google.com/maps/place/Taman+Suropati/data=!4m7!3m6!1s0x2e69f416e4052ef9:0x8b3359cdbfba5a81!8m2!3d-6.199387!4d106.8326333!16s%2Fg%2F120z1syk!19sChIJ-S4F5Bb0aS4RgVq6v81ZM4s?authuser=0&hl=id&rclk=1,"4,6",Jakarta,Alam,0,"Jl. Taman Suropati No.5, RT.5/RW.5, Menteng, Kec. Menteng, Kota Jakarta Pusat, Daerah Khusus Ibukota Jakarta 10310, Indonesia",Ruang hijau dengan jalan kecil & patung
Taman Margasatwa Ragunan,https://www.google.com/maps/place/Taman+Margasatwa+Ragunan/data=!4m7!3m6!1s0x2e69edfdb17f7b7d:0xf9dd2a3f5ab5069a!8m2!3d-6.3059887!4d106.820353!16zL20vMDdfZmRo!19sChIJfXt_sf3taS4Rmga1Wj8q3fk?authuser=0&hl=id&rclk=1,"4,5",Jakarta,"Safari, Alam",40000,"Jl. Harsono Rm Dalam No.1, Ragunan, Ps. Minggu, Kota Jakarta Selatan, Daerah Khusus Ibukota Jakarta 12550, Indonesia",Kebun binatang luas di hutan tropis
Taman Mini Indonesia Indah,https://www.google.com/maps/place/Taman+Mini+Indonesia+Indah/data=!4m7!3m6!1s0x2e69ed50d076a261:0x73127b9ecf2da0c!8m2!3d-6.3020386!4d106.8898924!16zL20vMDhiaHFr!19sChIJYaJ20FDtaS4RDNry7LknMQc?authuser=0&hl=id&rclk=1,"4,6",Jakarta,"Edukasi, Anak",35000,"Jl. Taman Mini Indonesia Indah, Ceger, Kec. Cipayung, Kota Jakarta Timur, Daerah Khusus Ibukota Jakarta 13820, Indonesia",Taman yg memamerkan keindahan Indonesia
Taman Alam Mangrove Angke Kapuk,https://www.google.com/maps/place/Taman+Wisata+Alam+Mangrove+Angke+Kapuk/data=!4m10!3m9!1s0x2e6a1d2589502ba3:0xc39c90629ab16290!5m2!4m1!1i2!8m2!3d-6.1064903!4d106.7368887!16s%2Fg%2F1pzpnxtjc!19sChIJoytQiSUdai4RkGKxmmKQnMM?authuser=0&hl=id&rclk=1,"4,3",Jakarta,Alam,35000,"Jl. Garden House, Kamal Muara, Kec. Penjaringan, Jkt Utara, Daerah Khusus Ibukota Jakarta 14470, Indonesia",Hutan bakau dengan beragam satwa liar
Pasar Seni,https://www.google.com/maps/place/Pasar+Seni/data=!4m7!3m6!1s0x2e6a1e184ec2b8f3:0x8fd2a44632896350!8m2!3d-6.1264924!4d106.8389517!16s%2Fg%2F11f4v4yjc0!19sChIJ87jCThgeai4RUGOJMkak0o8?authuser=0&hl=id&rclk=1,"4,4",Jakarta,Budaya,0,"Kuala Lumpur City Centre, 50050 Kuala Lumpur, Federal Territory of Kuala Lumpur, Malaysia",Pusat seni & kerajinan sejak 1977
Taman Situ Lembang,https://www.google.com/maps/place/Taman+Situ+Lembang/data=!4m7!3m6!1s0x514107ef6417075:0xdf97f027bb9bcd42!8m2!3d-6.1973783!4d106.8343448!16s%2Fg%2F11bzq3fvt7!19sChIJdXBB9n4QFAURQs2buyfwl98?authuser=0&hl=id&rclk=1,"4,6",Jakarta,Alam,0,"Jl. Lembang Terusan No.D-59, RT.6/RW.5, Menteng, Kec. Menteng, Kota Jakarta Pusat, Daerah Khusus Ibukota Jakarta 12910, Indonesia",Taman indah dengan kolam pancing kecil
Monumen Nasional,https://www.google.com/maps/place/Monumen+Nasional/data=!4m7!3m6!1s0x2e69f5d2e764b12d:0x3d2ad6e1e0e9bcc8!8m2!3d-6.1753924!4d106.8271528!16zL20vMDNxN2hz!19sChIJLbFk59L1aS4RyLzp4OHWKj0?authuser=0&hl=id&rclk=1,"4,6",Jakarta,Sejarah,0,"Merdeka Square, Jakarta, Jalan Lapangan Monas, Gambir, Central Jakarta City, Jakarta 10110, Indonesia",Monumen kemerdekaan Indonesia yg ikonis
Allianz Eco Park,https://www.google.com/maps/place/Allianz+Eco+Park/data=!4m7!3m6!1s0x2e6a1e1a241e3a9d:0x9ecf31ac76753a1a!8m2!3d-6.1257185!4d106.836356!16s%2Fg%2F11bc7twhcf!19sChIJnToeJBoeai4RGjp1dqwxz54?authuser=0&hl=id&rclk=1,"4,6",Jakarta,Alam,24000,"Jl. Lodan Timur No.7, RW.10, Ancol, Kec. Pademangan, Jkt Utara, Daerah Khusus Ibukota Jakarta 14430, Indonesia",Taman outdoor & aktivitas petualangan
Taman Tangkuban Perahu,https://www.google.com/maps/place/Taman+Tangkuban+Perahu/data=!4m7!3m6!1s0x2e69f40e096d5be3:0x10014e518362e4dd!8m2!3d-6.2076521!4d106.8352437!16s%2Fg%2F11b7xsf2hd!19sChIJ41ttCQ70aS4R3eRig1FOARA?authuser=0&hl=id&rclk=1,"4,5",Jakarta,Alam,0,"Tangkuban Perahu No.1 5, RT.5/RW.1, Guntur, Kecamatan Setiabudi, Kota Jakarta Selatan, Daerah Khusus Ibukota Jakarta 12980, Indonesia",Taman melingkar dengan peralatan bermain
Taman Impian Ancol,https://www.google.com/maps/place/Taman+Impian+Ancol/data=!4m7!3m6!1s0x2e6a1e3c5483ced3:0x7374f8aeaee75bc0!8m2!3d-6.1256079!4d106.8465549!16s%2Fg%2F11c1wk3sw_!19sChIJ086DVDweai4RwFvnrq74dHM?authuser=0&hl=id&rclk=1,"4,6",Jakarta,"Anak, Wahana",30000,"Jl. Lodan Timur No.7, RT.14/RW.10, Ancol, Kec. Pademangan, Jkt Utara, Daerah Khusus Ibukota Jakarta 14430, Indonesia","Resor dengan golf, taman hiburan, dsb."
KidZania Jakarta,https://www.google.com/maps/place/KidZania+Jakarta/data=!4m7!3m6!1s0x2e69f1510ffe98ed:0xc9aa1813b2c14c4c!8m2!3d-6.2250735!4d106.8097144!16s%2Fg%2F121xqmbm!19sChIJ7Zj-D1HxaS4RTEzBshMYqsk?authuser=0&hl=id&rclk=1,"4,6",Jakarta,"Edukasi, Anak",225000,"Pacific Place Mall, Jl. Jenderal Sudirman No.Kav. 52-53, RT.5/RW.3, Senayan, Kec. Kby. Baru, Kota Jakarta Selatan, Daerah Khusus Ibukota Jakarta 12190, Indonesia",·
Hutan Kota Srengseng,https://www.google.com/maps/place/Hutan+Kota+Srengseng/data=!4m7!3m6!1s0x2e69f72f3706b613:0x11aab933dc9527ac!8m2!3d-6.2106945!4d106.7643954!16s%2Fg%2F1hm6ll8n5!19sChIJE7YGNy_3aS4RrCeV3DO5qhE?authuser=0&hl=id&rclk=1,"4,4",Jakarta,Alam,3000,"Jl. H. Kelik, RT.8/RW.6, Srengseng, Kec. Kembangan, Kota Jakarta Barat, Daerah Khusus Ibukota Jakarta 11630, Indonesia",Ruang hijau besar dengan jalur berpaving
Dunia Fantasi,https://www.google.com/maps/place/Dunia+Fantasi/data=!4m7!3m6!1s0x2e6a1e1a80420c57:0x275b93253d2232e3!8m2!3d-6.1253124!4d106.8335377!16s%2Fm%2F0b65fpr!19sChIJVwxCgBoeai4R4zIiPSWTWyc?authuser=0&hl=id&rclk=1,"4,6",Jakarta,"Wahana, Anak",188000,"Jl. Lodan Timur No.7, Ancol, Kec. Pademangan, Jkt Utara, Daerah Khusus Ibukota Jakarta 14430, Indonesia",Taman hiburan plus Wisata & atraksi air
Jakarta Bird Land,https://www.google.com/maps/place/Jakarta+Bird+Land/data=!4m7!3m6!1s0x2e6a1f82a1321b0b:0x568665f610cdffda!8m2!3d-6.1265011!4d106.8429718!16s%2Fg%2F11jygcs8mf!19sChIJCxsyoYIfai4R2v_NEPZlhlY?authuser=0&hl=id&rclk=1,"4,7",Jakarta,"Safari, Alam",80000,"Jl. Lodan timur No.7, Ancol, Kec. Pademangan, Jkt Utara, Daerah Khusus Ibukota Jakarta 14430, Indonesia",
Taman Pandang Istana,https://www.google.com/maps/place/Taman+Pandang+Istana/data=!4m7!3m6!1s0x2e69f5d4058a4bbf:0xdf7aecafd6f46e32!8m2!3d-6.1721641!4d106.8233829!16s%2Fg%2F11cp5ddmg8!19sChIJv0uKBdT1aS4RMm701q_set8?authuser=0&hl=id&rclk=1,"4,5",Jakarta,Sejarah,0,"Jalan Silang Monas Barat Laut, RT.5/RW.2, Gambir, RT.5/RW.2, Gambir, Kecamatan Gambir, Kota Jakarta Pusat, Daerah Khusus Ibukota Jakarta 10110, Indonesia",Area hijau terbuka dengan bangku
Taman Anggrek Ragunan,https://www.google.com/maps/place/Taman+Anggrek+Ragunan/data=!4m7!3m6!1s0x2e69edfc7abd128d:0x4b91b44fa1ce0b83!8m2!3d-6.3112113!4d106.8217018!16s%2Fg%2F11b7fhc8r7!19sChIJjRK9evztaS4RgwvOoU-0kUs?authuser=0&hl=id&rclk=1,"4,7",Jakarta,Alam,1000,"Taman Anggrek, RT.9/RW.7, Ragunan, Ps. Minggu, Kota Jakarta Selatan, Daerah Khusus Ibukota Jakarta 12550, Indonesia",Pasar outdoor untuk tanaman hias
Museum Macan (Modern and Contemporary Art in Nusantara),https://www.google.com/maps/place/Museum+Macan+%28Modern+and+Contemporary+Art+in+Nusantara%29/data=!4m7!3m6!1s0x2e69f71dafebfd57:0xf19623593db3f0f6!8m2!3d-6.1910434!4d106.7679858!16s%2Fg%2F11f4v4x9mf!19sChIJV_3rrx33aS4R9vCzPVkjlvE?authuser=0&hl=id&rclk=1,"4,5",Jakarta,"Edukasi, Anak",70000,"AKR Tower Level M, Jl. Panjang No.5, Kb. Jeruk, Kec. Kb. Jeruk, Kota Jakarta Barat, Daerah Khusus Ibukota Jakarta 11530, Indonesia",·
Sea World Indonesia,https://www.google.com/maps/place/Sea+World+Indonesia/data=!4m7!3m6!1s0x2e6a1e22b8ad5c1b:0x8eea0c4c3f8cb410!8m2!3d-6.126601!4d106.842958!16s%2Fg%2F1n03_59lk!19sChIJG1ytuCIeai4RELSMP0wM6o4?authuser=0&hl=id&rclk=1,"4,5",Jakarta,"Air, Wahana, Anak",280000,"Jl. Lodan timur No.7, RT.14/RW.10, Ancol, Kec. Pademangan, Jkt Utara, Daerah Khusus Ibukota Jakarta 14430, Indonesia",Akuarium modern dengan acara beri makan
Bounce Street Asia - Trampoline Park | Tempat Hiburan & Rekreasi Keluarga Terbaik di Jakarta Utara & Kelapa Gading,https://www.google.com/maps/place/Bounce+Street+Asia+-+Trampoline+Park+%7C+Tempat+Hiburan+%26+Rekreasi+Keluarga+Terbaik+di+Jakarta+Utara+%26+Kelapa+Gading/data=!4m7!3m6!1s0x2e69f5443bf80ac5:0x6af3e6d33c2212ff!8m2!3d-6.1477623!4d106.8962366!16s%2Fg%2F11bwh91vqw!19sChIJxQr4O0T1aS4R_xIiPNPm82o?authuser=0&hl=id&rclk=1,"4,5",Jakarta,"Ekstrem, Wahana",150000,"sentra bisnis, Jalan, Jl. Artha Gading Sel. No.Kav 8 Blok B, RT.18/RW.8, Klp. Gading Bar., Kec. Klp. Gading, Jkt Utara, Daerah Khusus Ibukota Jakarta 14240, Indonesia",Pusat main dengan trampolin & kolam busa
Tebet Eco Park,https://www.google.com/maps/place/Tebet+Eco+Park/data=!4m7!3m6!1s0x2e69f36d922448d5:0x83736dbd7ef2b25c!8m2!3d-6.2373489!4d106.8529248!16s%2Fg%2F11fj9k587d!19sChIJ1Ugkkm3zaS4RXLLyfr1tc4M?authuser=0&hl=id&rclk=1,"4,7",Jakarta,Alam,0,"Jl. Tebet Barat Raya, RT.1/RW.10, Tebet Bar., Kec. Tebet, Kota Jakarta Selatan, Daerah Khusus Ibukota Jakarta 12820, Indonesia",Taman tepi sungai luas & jalur joging
